{
  "schema_version": "1.0",
  "dataset_id": "tokito-example-corpus",
  "dataset_revision": "example-r1",
  "annotation_revision": "annotation-v1",
  "created_at": "2026-08-29T00:00:00Z",
  "records": [
    {
      "annotation_id": "annotation-1",
      "item_id": "board-a-session-1-frame-1",
      "review_status": "verified",
      "identity": { "class_id": "example-component", "status": "known", "instance_id": "u1", "reference_designator": "U1" },
      "geometry": [{ "type": "bbox", "coordinate_space": "normalized", "values": [0.1, 0.1, 0.2, 0.2] }],
      "state": { "presence": "present", "orientation": "pin-one-up" },
      "uncertainty": { "confidence": 1.0, "ambiguous": false, "reasons": [] },
      "unobservable_regions": []
    }
  ],
  "integrity": {
    "inventory_manifest_digest": "sha256:0000000000000000000000000000000000000000000000000000000000000000",
    "manifest_digest": "sha256:0000000000000000000000000000000000000000000000000000000000000000"
  }
}
